name,path,,age,belief.in.god,condition_number,contribution,correct.crt.answers,country.of.residence..232.us.,datelastaction,datestarted,decision.time,education,failed.comprehension,faith_in_int,female,how.much.do.you.trust.people.in.your.life,id,income,intuitive.crt.answers,ipaddress,length.of.priming.paragraph,need_for_cog,normalized.contribution,obeyed.time.constraint...1.if.from.condition.without.time.constraint.,physical.lab,prediction.of.others.mean.contribution,previous.experience.w.econ.games..1.none.,primed.for.intuition,primed.for.reflection,priming.paragraph,risk.taking,social.risk.taking,strategy.description,time.delay,time.pressure,time.reading.instructions,time_pred,txtorg_id,us.resident,what.cont.maximizes.group.payoff,what.cont.maximizes.your.payoff
,,256,22,8,10,20,1,232,4/27/12 21:13,4/27/12 20:48,6,4,0,6.5,1,7,1997,2,2,99.108.213.122,9,8.1,0.5,0,0,na,3,1,0,"a week later we got our tests back, and i saw that my score was one of the best in the class. it turns out that our teacher had meant to trick us with that problem and gave extra credit to those few of us with enough chutzpah to write the corr",7,3.5,"i wanted to make sure i got at least some bonus, but i also wanted to contribute to the good of the group. it was a cautious contribution.",0,0,95,na,4d09c2c4-7591-11e2-89cc-88532e617cea,1,40,0
,,257,42,4,10,22,0,232,4/28/12 11:41,4/28/12 11:34,9,6,0,7.1,1,6,2100,7,3,76.217.239.32,8,7.1,0.55,0,0,na,3,1,0,"when i met my husband, he was three things i always swore i would never marry, he was a social worker (like me), divorced and had a son. i always believed that i would never marry someone who had any of these qualities.  i thought he was nice a",7,1.9,i thought half sounded fair,0,0,4,na,4d09e8f8-7591-11e2-89cc-88532e617cea,1,40,0
,,258,41,10,10,40,1,231,4/25/12 11:53,4/25/12 11:19,29,4,0,7.9,0,8,1120,6,2,86.8.216.198,9,7.4,1,0,0,na,1,1,0,"when i was driving on london's orbital motorway, the m25, i heard a rattling noise at the back of my vehicle. i continued driving while considering what it could be. the rattling grew louder and my instinct that something was wrong grew stronge",2,2.8,hoped that fellow participants would be as altruistic as me and we'd all benefit.,0,0,89,na,4d0a10e4-7591-11e2-89cc-88532e617cea,0,40,0
,,259,24,6,10,40,1,232,4/23/12 20:49,4/23/12 20:35,5,5,0,7.4,0,7,422,1,2,71.232.180.111,8,9.4,1,0,0,na,1,1,0,as i was applying to jobs right out of highschool i had to find a job. i had to decide whether to move with my friends or take something that would be good for my resume. i ended up taking a position that would be good for my resume because int,11,3.2,because i am hoping if everyone contributes their full amount we can all get 80 cents versus me being selfish and possibly getting a dollar only if everyone else is selfless.,0,0,86,na,4d0a4406-7591-11e2-89cc-88532e617cea,1,40,0
,,260,50,10,10,20,0,232,4/24/12 13:43,4/24/12 13:29,15,5,0,8.6,1,5,781,6,2,74.176.185.120,8,8.799999,0.5,0,0,na,3,1,0,"i was in a lot of debt from tons of medical bills that piled up on me after my appendectomy. my job didn't pay me enough money to cover all these bills. i was desperate, so i seriously considered getting a payday loan to hold me over. i researc",10,2.6,"i thought 20 cents, the middle of 40 cents, was fair and balanced for both me and the group.",0,0,102,na,4d0a7eee-7591-11e2-89cc-88532e617cea,1,40,0
,,261,26,1,10,40,3,232,4/25/12 22:55,4/25/12 22:45,6,4,0,5.1,0,6,1312,4,0,76.121.98.232,9,9.5,1,0,0,na,4,1,0,"in the olympic national park i was attempting a difficult backpacking trip alone.  while the first half of my hike went well, poor weather and a very difficult trail ascension made the rest trying.  because of the weather and the damaged trail",4,3.1,i feel that 40 cents is not too much to risk for the benefit of the group.,0,0,25,na,4d0abd28-7591-11e2-89cc-88532e617cea,1,40,0
,,262,59,7,10,40,0,232,4/25/12 22:29,4/25/12 22:06,9,2,0,6.5,1,8,1300,6,2,72.74.196.18,9,6.9,1,0,0,na,1,1,0,as a new wife and mother i thought marriage was not for me. i called a friend to babysit. i then looked for work. then took a test to find my abilities.my instincts were better. i went into an investment bank to apply for a job. i was offered e,6,2.9,"i'd like to think most people are fair, and willing to get the most without penalizing others.",0,0,179,na,4d0b0238-7591-11e2-89cc-88532e617cea,1,40,0
,,263,31,1,10,10,1,232,4/27/12 18:40,4/27/12 18:30,10,2,0,7.6,1,2,1952,7,2,184.41.105.174,10,8.7,0.25,0,0,na,1,1,0,i once had aob that i was incredibly unhappy in.  it paid very little and the owner of the company was a worthless turd.  another employee had a job interview on avery cold day in february.  he was going to call and cancel.  he hadtold me about,1,3.9,i risked very little so that i would still make a bonus,0,0,51,na,4d0b437e-7591-11e2-89cc-88532e617cea,1,40,0
,,264,31,2,10,40,2,232,4/24/12 3:01,4/24/12 2:48,5,5,0,5.4,1,8,581,9,1,70.116.72.216,8,5.8,1,0,0,na,3,1,0,"while headed home to my empty house late at night, i noticed an unfamiliar vehicle following me. i took a few odd turns, and the car was still behind me. instead of driving home, i called a friend. she waited at her door and let me in as soon a",8,2.4,"i can't spend all my time worrying about what other people do. i have to do what i feel is right, and hope they do the same. in real life, we can see a lot of what other people are doing, which may sway our decisions about what we do (i.e. we m",0,0,55,na,4d0b8316-7591-11e2-89cc-88532e617cea,1,40,0
,,265,44,10,10,40,3,232,4/23/12 23:39,4/23/12 23:22,11,5,0,6.8,1,3,485,5,0,100.3.122.129,12,8.5,1,0,0,na,2,1,0,i was shopping at goodwill and i came across a louis vuitton purse.  i asked the sales lady if the purse was genuine or fake. she said that she was pretty sure it was a fake.  i saw a small leather code inside the purse.  i just had a gut feeli,2,3.1,it seemed the best way to double everyone's money.  i was trying to consider what would be beneficial to all of us.,0,0,80,na,4d0bbd4a-7591-11e2-89cc-88532e617cea,1,40,0
,,266,59,10,10,40,2,232,4/26/12 15:23,4/26/12 15:11,7,2,0,7.6,1,6,1613,1,1,75.171.222.139,8,5.2,1,0,0,na,3,1,0,i had tried my hand at selling newspapers and encyclopedias over the phone and had failed at both. i decided to apply at a place where you called households to see if they had any used items to donate. i got the job and i had a feeling that thi,2,1.4,"it seemed like the fair thing to do. if i decided to keep my money, i would not know if everyone else had decided to do the same thing.",0,0,83,na,4d0bf58a-7591-11e2-89cc-88532e617cea,1,40,0
,,267,32,3,10,26,0,232,4/23/12 18:24,4/23/12 18:11,39,2,0,8,1,4,337,6,3,174.49.218.202,9,5.6,0.65,0,0,na,3,1,0,"when i was a resident assistant in college, i was doing my hourly rounds. i came across a female on a different floor than mine that was crying in the hallway. i sat down with her and she started telling me a story about her and her boyfriend.",7,2.5,i was trying to be fair to the other players while still keeping some for me.,0,0,145,na,4d0c2f1e-7591-11e2-89cc-88532e617cea,1,40,0
,,268,23,8,10,40,0,232,4/25/12 22:55,4/25/12 22:44,22,2,0,7.9,0,3,1309,1,2,74.66.90.191,8,6.2,1,0,0,na,1,1,0,"in my last relationship. something never struck me quite right--the distancing, the lack of communication ect. she lived far away as well, in new jersey. at first, we would see each other a few times per week and things were going good. but as",9,3.7,"i really wasn't sure whether the others would contribute or not. i mean, the group bonus would be nice but i'm just not completely certain if everyone did.",0,0,74,na,4d0c6664-7591-11e2-89cc-88532e617cea,1,40,0
,,269,23,1,10,40,3,38,4/27/12 4:30,4/27/12 4:15,4,5,0,5.3,0,9,1822,5,0,70.26.94.107,8,8.4,1,0,0,na,1,1,0,i once posted a resume on an on-line job website. about a day later i received a call from a company to come in for an interview. immediately i had a bad feeling about the situation. it all seemed a little too good to be true. i went to the int,9,3,"no one deserves an eternity of punishment, and no god that is good would allow that to happen.",0,0,97,na,4d0c9de6-7591-11e2-89cc-88532e617cea,0,40,0
,,270,24,9,10,30,0,232,4/24/12 16:37,4/24/12 16:27,15,2,0,8.2,0,8,846,1,3,184.9.172.168,8,7.5,0.75,0,0,na,1,1,0,my friends and i were out at a bar one night drinking. one of them wanted to drive home after they had been drinking. i had a feeling they would get arrested if they did. we took a cab home and saw that there was a road block that would have,11,3.4,i felt it was the right decision,0,0,53,na,4d0cd3c4-7591-11e2-89cc-88532e617cea,1,40,0
,,271,31,2,10,0,3,232,4/28/12 1:35,4/28/12 1:23,29,5,0,5.7,0,8,2042,6,0,68.45.127.209,8,8.8,0,0,0,na,2,1,0,"my boss offered me an opportunity to head up a new project.  he knew i was looking to get promoted, and he said it would be a good opportunity to do that.  i decided to go for it.  later when i got home i started to worry that it was more respo",3,2.3,"i started to go with the full contribution hoping others would do the same, but the more i thought about it, i felt like other users would be risk averse and contribute nothing, so i'd be better off contributing nothing.",0,0,48,na,4d0d07c2-7591-11e2-89cc-88532e617cea,1,40,0
,,272,26,3,10,40,0,232,4/28/12 4:30,4/28/12 4:12,9,2,1,7,1,7,2066,4,3,67.164.90.239,10,6.9,1,0,0,na,1,1,0,"one time when i was about 10 years old, my brother and i went on a trip to a theme park with our father. my brother and i were waiting in one of the long lines for one of the rides. we were about halfway through the line when the ride broke. th",8,3.6,"i chose to contribute all of my money because i wanted to at lease double it. i was worried if i kept it, others would have kept it as well.",0,0,114,na,4d0d40e8-7591-11e2-89cc-88532e617cea,1,0,40
,,273,29,1,10,0,2,232,4/23/12 19:36,4/23/12 19:25,7,4,0,8,0,7,383,3,0,69.242.83.189,9,8,0,0,0,na,4,1,0,one time my intuition lead me in the right direction kept me from possibly being severely injured or killed.  i had done something that most people would common sense would do but the thing was i did not usually make decisions like this at the,7,3.5,"i have experience with similar surveys on mturk and i have found that most of the time other people are selfish with their decisions.  i believe this is primarily due to the fact that they are dealing with strangers.  anyway, i'm done trying to",0,0,68,na,4d0d8224-7591-11e2-89cc-88532e617cea,1,40,0
,,274,47,10,10,20,3,232,4/24/12 2:28,4/24/12 2:20,4,5,0,4,1,5,563,7,0,76.89.85.99,8,6,0.5,0,0,na,3,1,0,"i met my husband by accident, and i did not want to meet him.  but i was intrigued.  i thought that i would never see him again.  but i did see him a week later.  we hit it off and enjoyed the evening.  when i left, i had the feeling that we wo",2,2.4,i should contribute something for the others so half for them and half for me.,0,0,49,na,4d0dc22a-7591-11e2-89cc-88532e617cea,1,40,0
,,275,27,1,10,0,1,232,4/23/12 19:28,4/23/12 19:15,11,5,0,8.299999,0,3,379,1,2,68.37.73.1,8,8.799999,0,0,0,na,3,1,0,"with them.  my main friend ended up getting caught by his parents and spent about 9 months in juvenile detention, as did 2 of my other friends.  i went on to win the award for most improved student my senior year of high school and graduated w",9,3.8,i don't trust people very much and my highest payoff would be 100 if the other 2 people contributed everything.  i figure they would not do that considering that 40 cents is almost equal to what we are being paid just for taking this survey.  i,0,0,64,na,4d0dea48-7591-11e2-89cc-88532e617cea,1,40,0
,,276,36,10,10,40,0,232,4/23/12 18:22,4/23/12 18:01,20,2,0,6.7,0,5,327,4,3,184.8.160.226,10,6.2,1,0,0,na,1,1,0,"once i was looking for a job and, was out of money. i didn't know what to do with no money. i then remembered when i was a teenager my father taught me how to clean windows for businesses in a local area. with that being my first instinct to ma",4,2.3,i read my bible everyday and am a converted christian.,0,0,121,na,4d0e0a78-7591-11e2-89cc-88532e617cea,1,40,0
,,277,37,10,10,0,1,38,4/24/12 5:28,4/24/12 5:15,23,5,0,6,0,7,646,10,2,209.145.100.164,8,7.8,0,0,0,na,2,1,0,we were just married and expecting our second child. we decided to purchase our first home instead of renting. we went for a walk down a street we'd never been before. they just happened to be putting up a for sale sign in the yard. we looked a,8,3,went for the sure thing. cannot trust someone i do not know.,0,0,51,na,4d0e2954-7591-11e2-89cc-88532e617cea,0,40,0
,,278,21,10,11,0,0,232,4/25/12 20:42,4/25/12 20:30,5,2,0,7.3,0,7,1284,1,3,207.38.230.32,8,8,0,0,0,na,3,0,1,"there was a time in my life where everyone was asking me to produce, in one way or another. i always would stress and worry over this and didn't think i deserved to sit back and think about what i should do. this time in my life was probably th",4,2.9,because i could make more this way.,0,0,76,na,4d0e4948-7591-11e2-89cc-88532e617cea,1,40,0
,,279,28,10,11,16,0,108,4/26/12 6:55,4/26/12 6:31,26,4,0,6,1,7,1498,3,2,72.27.82.137,9,7.9,0.4,0,0,na,3,0,1,at the completion of my associate degree i found out i was pregnant with my daughter. my plan prior to finding out i was pregnant was to simply continue on to the bachelors degree. however my pregnancy altered that at which time i changed my pl,3,4.1,"i believe that one should not only think of self when making decisions, therefore i am willing to share what i have.",0,0,62,na,4d0e673e-7591-11e2-89cc-88532e617cea,0,40,0
,,280,21,5,11,20,0,232,4/26/12 4:18,4/26/12 3:58,33,5,0,6.8,1,2,1448,8,3,24.11.34.133,8,5.2,0.5,0,0,na,2,0,1,"a time when carefully reasoning through a situation led me in the right direction was when i was in a bad relationship.  in this situation, i was torn between what my head and what my heart were telling me to do.  i was being treated unfairly b",2,2.8,"i chose my answer based on how strong i believe my beliefs are and how i carry them out, but i also factored in the fact that i do not live by a strict religion on a daily basis and do not always attend services.",0,0,68,na,4d0e85ca-7591-11e2-89cc-88532e617cea,1,40,0
,,281,26,5,11,20,0,232,4/27/12 20:33,4/27/12 20:22,28,4,0,7.7,0,7,1987,2,3,128.187.97.22,8,6.2,0.5,0,0,na,2,0,1,"i was trying to decide to either continue living with my best friend or to move out on my own (and room with strangers who i've never met). i considered how my best friend no longer spends any time with me, but instead is always with his girlfr",7,2.8,"i thought i would leave it up to chance, since i don't want to think of myself as a selfish person, but i do maintain a bit of self-interest",0,0,50,na,4d0ea3e8-7591-11e2-89cc-88532e617cea,1,40,0
,,282,37,10,11,40,0,232,4/23/12 23:35,4/23/12 23:19,7,5,1,9.3,1,9,482,6,3,99.100.204.19,8,7.6,1,0,0,na,3,0,1,i had to prevent my uncle from hurting me during a fight at my grandmother's home. i reasoned that i had to convince him to calm down and at the same time put distance between us. i slowly stepped back while telling him that i was going outside,1,3.8,i wanted to maximize the amount the group could obtain overall. i was hoping that the other two participants in my group would do the same.,0,0,80,na,4d0ec954-7591-11e2-89cc-88532e617cea,1,40,20
,,283,25,1,11,0,3,232,4/24/12 5:33,4/24/12 5:24,9,4,0,5.9,0,1,650,2,0,173.175.177.11,8,5.9,0,0,0,na,4,0,1,"careful reasoning allowed me to figure out where i kept leaving my car keys. one time i thought i had lost my car keys, but then i started thinking back to where i had put them. after checking all the usual places where i usually put my car key",8,4,people benefit more by keeping the money for themselves and we cannot communicate with each other. the temptation is too strong.,0,0,47,na,4d0ee826-7591-11e2-89cc-88532e617cea,1,40,0
,,284,51,1,11,0,3,232,4/24/12 1:52,4/24/12 1:37,7,6,0,7.5,1,2,544,6,0,50.73.100.9,12,9.9,0,0,0,na,3,0,1,i had just taken over a new responsibility from my boss.  she suddenly went out on medical leave and was therefore not there to teach me how to do this new duty.  no one at my company had any experience in it.  there was also no documentation i,4,3.1,"i generally choose to do what is best for the group, but i decided in this case to do what is best for me, without taking the group into consideration, and, i must admit, i feel a bit guilty about it.",0,0,43,na,4d0f05f4-7591-11e2-89cc-88532e617cea,1,40,0
,,285,23,3,11,0,2,232,4/26/12 17:44,4/26/12 17:19,28,5,0,4.9,0,9,1659,1,0,71.139.163.201,8,8.6,0,0,0,na,5,0,1,"once, in college, i had no idea how to answer the questions on one of my midterms. i had not studied the material the night before due to studying for other tests. now, because this was an english class, i thought that i could at least talk abo",8,4.3,"i knew that the others would contribute what's in their best interest which is 0. therefore, i would contribute the same amount. everybody is motivated by their own self-interest.",0,0,362,na,4d0f253e-7591-11e2-89cc-88532e617cea,1,40,0
,,286,25,10,11,22,0,232,4/26/12 1:11,4/26/12 0:59,11,4,0,8.200001,1,8,1376,6,3,96.226.30.90,11,7.6,0.55,0,0,na,3,0,1,"a time that i had to reason through a situation was with my health. i have been struggling to overcome a certain disorder for many years now, and i was trying everything to feel better. i was going to conventional doctors for many years, severa",7,3,"i wanted the group to get something, but i wanted to keep some for myself as well. i tried to do things as fairly as i thought possible.",0,0,54,na,4d0f428a-7591-11e2-89cc-88532e617cea,1,40,0
,,287,29,3,11,40,3,30,4/26/12 15:42,4/26/12 15:22,5,6,0,3.3,0,3,1615,3,0,143.107.178.50,10,8.5,1,0,0,na,2,0,1,"two years ago, i did not know if i should start a literary career. i already had a fulfilling job but i felt that writing could be something special. however i was not sure if i would be successful because i had so little time to devote to lite",3,2,it seems more rational to contribute the maximum quantity in order to provide the group as a whole the greatest chance to maximize income.,0,0,82,na,4d0f6026-7591-11e2-89cc-88532e617cea,0,40,0
,,288,49,10,11,30,1,232,4/24/12 6:30,4/24/12 6:17,14,5,0,8.7,0,7,677,2,2,24.113.237.182,8,8.6,0.75,0,0,na,2,0,1,"i was a pilot of an aircraft,and lost an engine. i fell back on my training and followed procedure exactly. i then had to reason out the best location for landing. since i was at a higher altitude, i decided to proceed to my destination some 12",9,3.7,just a hunch that that would stimulate the exercise,0,0,105,na,4d0f7de0-7591-11e2-89cc-88532e617cea,1,40,0
,,289,27,10,11,20,1,232,4/26/12 11:02,4/26/12 10:34,10,2,1,7.4,0,8,1548,3,2,69.10.38.158,11,6.1,0.5,0,0,na,1,0,1,"i once started an investment company with an egyptian partner, based in costa rica. the investment manager who was based in usa was very accommodating with new investors i forwarded to him. however, started delaying the returns each time a litt",9,2.9,"simply because i believe in giving and taking risks, and karma, if i think about others before me, it will somehow benefit me in the long run (if not in this particular survey say).",0,0,133,na,4d0f9a28-7591-11e2-89cc-88532e617cea,1,40,40
,,290,19,10,11,40,2,166,4/25/12 7:53,4/25/12 7:33,3,2,0,7.2,0,7,1081,1,1,39.47.196.47,10,6.7,1,0,0,na,4,0,1,"last year some of my friends started smoking. and eventually got me into it.soon my family found out about it, and gave me threats and warnings. which made me think, after some time i realized i was actually doing harm to my self.although i was",7,3,"well. i had very less chances of receiving 100 cents because if i think like that, the others might as well. i contributed 40 because if by a good chance the other three did aswell. i would get 80 cents.",0,0,81,na,4d0fb576-7591-11e2-89cc-88532e617cea,0,40,0
,,291,26,5,11,10,3,195,4/23/12 20:14,4/23/12 19:48,16,6,1,5.2,1,5,392,1,0,178.149.87.119,8,9.3,0.25,0,0,na,2,0,1,"i work in a private school. one of my students offered to pay me a large amount of money, much more than i earn, to teach him at home. consequently, he would stop going to the school i work in, and stop paying the scholarship. the offer was att",3,2.9,"i gave others 10 cents, because i don't believe other people, and i was afraid of losing it all. i wanted to play safe. however, i am aware of the fact that giving more increases the chances for getting back more.",0,0,84,na,4d0fd434-7591-11e2-89cc-88532e617cea,0,40,40
,,292,53,10,11,10,3,232,4/25/12 15:41,4/25/12 15:25,97,3,0,2.6,1,4,1182,1,0,72.240.97.16,9,6.3,0.25,0,0,na,3,0,1,"but it worked out by me calling this plumber, because he is very, very nice plus he knew my dad, so we had that in common to talk about.",3,2.9,"because usually other turkers are greedy, so i decided to stickup for myself for a change.",0,0,144,na,4d0ff46e-7591-11e2-89cc-88532e617cea,1,40,0
,,293,23,3,11,0,3,232,4/24/12 5:37,4/24/12 5:29,5,5,0,6,1,4,654,4,0,199.38.234.114,10,8.7,0,0,0,na,3,0,1,"my internet recently died and instead of yelling and screaming out loud, i decided to try to fix it with logic. yelling and screaming feels good, but it doesn't really fix anything. so i sat down and questioned what could be wrong with the inte",8,4.4,it would benefit both the group and me if i didn't contribute all that much.,0,0,30,na,4d1014b2-7591-11e2-89cc-88532e617cea,1,40,0
,,294,24,1,11,20,0,232,4/26/12 11:56,4/26/12 11:47,6,4,0,8.8,1,10,1562,5,3,173.163.17.33,10,8.2,0.5,0,0,na,1,0,1,there was a project at work that we had to do as a team. i was appointed team leader and had final say. one of my co-workers didn't like me and was trying to undermine my decision and mess up the project. it was a research project and we needed,10,2.1,i decided half that way i don't lose too much.,0,0,40,na,4d103226-7591-11e2-89cc-88532e617cea,1,40,0
,,295,24,8,11,40,1,232,4/26/12 22:21,4/26/12 22:11,3,4,0,7.5,0,8,1762,4,1,50.138.4.35,8,7.9,1,0,0,na,2,0,1,"i once put my hand into a fantasy financial tournament. it was an application in which you bought and traded stock. the winner got a $5000 check. it was about 2 years ago. i kept steadfast on my stocks, i held when others sold. i bought when po",9,4.5,"i chose 40 cents because it was the most logical choice. i acted upon the logic that everyone could contribute a certain amount of money and we all win, and in order to obtain the outcome of that line of thought, i had to act my part, which was",0,0,37,na,4d104f40-7591-11e2-89cc-88532e617cea,1,40,0
,,296,19,1,11,16,2,154,4/27/12 13:41,4/27/12 13:30,13,2,0,6.7,1,4,1884,2,0,82.157.11.55,9,8.8,0.4,0,0,na,4,0,1,"the big picture_ to the details. finally, i got a formula i could apply. i did so and the answer was correct. only later did i find out that i could had only looked up that formula, nothing more. but anyway, i got an a.",4,3.8,"i decided to contribute something in case others did - but keep something as well, in case others didn?t.",0,0,38,na,4d106cbe-7591-11e2-89cc-88532e617cea,0,40,0
,,297,33,8,11,20,2,232,4/25/12 23:03,4/25/12 22:55,8,4,1,8.5,1,9,1316,5,1,74.133.58.100,9,8.9,0.5,0,0,na,2,0,1,"i've worked in customer service for a very long time, and in my most recent stint, i worked for a cellular provider. i would assist customers with billing issues and other problems. one specific customer had an insane technical issue that had b",9,3,i figured it was the best choice between contributing and not contributing.,0,0,27,na,4d1088ac-7591-11e2-89cc-88532e617cea,1,40,20
,,298,20,10,11,40,2,232,4/23/12 20:08,4/23/12 19:59,10,4,0,7.2,0,8,399,5,1,68.250.187.108,8,7.4,1,0,0,na,2,0,1,"one time,i was out shopping. i only had $10 with me. i saw a movie i had been wanting to see, and thought about buying it. after about 20 minutes of thinking, i decided not to buy it in case i found something else i wanted. the next store i wen",5,3.2,i thought it best to be generous and benefit the whole group.,0,0,77,na,4d10a4e0-7591-11e2-89cc-88532e617cea,1,40,0
,,299,25,6,11,20,2,232,4/24/12 23:38,4/24/12 23:30,10,6,0,3.1,1,4,999,6,1,24.147.55.247,8,7.8,0.5,0,0,na,3,0,1,"after graduating college, i had to try to find a job. i applied to many jobs, but was unable to find the type of job that i was looking for. there was a great deal of more qualified competition. i had been planning on going back to graduate sch",5,3.2,"i wanted to make sure i got something out of it, but i didn't want to hoard it all.",0,0,40,na,4d10c088-7591-11e2-89cc-88532e617cea,1,40,0
,,300,26,4,11,0,1,232,4/25/12 3:38,4/25/12 3:10,27,5,0,5,1,5,1037,6,2,174.30.88.151,17,7.3,0,0,0,na,2,0,1,"i work as a clinical laboratory analyst in a medical screening lab. one of the tests i perform involves tandem mass spectrometry. awhile back, i was having great difficulty in producing acceptable chromatograms for our tests. in order to troubl",8,2.6,"i chose to contribute nothing on the off chance i'd be the only one in my group to do so. it was a risk, but i'm not afraid to lose money that wasn't mine to begin with.",0,0,46,na,4d10df14-7591-11e2-89cc-88532e617cea,1,40,0
,,301,28,10,11,40,0,232,4/26/12 2:36,4/26/12 2:10,6,2,1,7.3,1,6,1404,3,2,67.184.205.68,11,7,1,0,0,na,3,0,1,"there was a time when i was offered two dental assistant jobs. these jobs were located in different locations. one was close to my home, about 30 min bus ride away and the other was located about a hour bus ride away. as far as i knew from when",1,3.5,because i wanted to be a team player and dont think it would be fair for for other to contribute all of their money any i didnt do the same.,0,0,189,na,4d10fab2-7591-11e2-89cc-88532e617cea,1,40,20
